Symbol,Title,Date
apple,Apple Cash will offer virtual card numbers for online shopping,2024-02-12
apple,Apple has reportedly made foldable iPhone prototypes,2024-02-07
apple,The best Apple Watch in 2024,2024-02-23
apple,Engadget Podcast: Our Apple Vision Pro hangover,2024-02-16
apple,Apple Vision Pro teardown deconstructs the weird-looking EyeSight display,2024-02-05
apple,The Apple Vision Pro Lives Deep in the Uncanny Valley,2024-02-01
apple,Crying in Apple Vision Pro Is No Laughing Matter,2024-02-22
apple,Apple reaches possible settlement with the startup it sued for trade secret theft,2024-02-10
apple,Developers Are in Open Revolt Over Apple’s New App Store Rules,2024-02-12
apple,Apple says the iPhone 15’s battery has double the promised lifespan,2024-02-20
apple,The second-gen Apple HomePod is down to $285 in a rare sale,2024-02-23
apple,"21 Best Presidents' Day Deals (2024): Tech, Couches, and More",2024-02-16
apple,"21 Best Presidents' Day Deals (2024): Tech, Couches, and More",2024-02-16
apple,"Apple Pay is down for Chase customers, and perhaps others",2024-02-17
apple,"Apple Vision Pro review: magic, until it’s not",2024-01-30
apple,FCC commissioner wants to investigate Apple over Beeper Mini shutdown,2024-02-12
apple,Apple iOS 17.4: iMessage Gets Post-Quantum Encryption in New Update,2024-02-21
apple,A star creator’s go-to travel gear,2024-01-28
apple,Epic plans to launch its own iOS storefront in the EU this year,2024-02-16
apple,Tim Cook Teases Big AI Announcement for Apple Later This Year,2024-02-02
apple,You no longer have to visit an Apple Store if you forget your Vision Pro passcode,2024-02-12
apple,The Morning After: Apple has reportedly made multiple foldable iPhone prototypes,2024-02-08
apple,A piracy app outranked Netflix on the App Store before Apple pulled it,2024-02-14
apple,A new Vision Pro teardown shows Apple’s incredible pixel density,2024-02-07
apple,Apple’s latest prototype AI tool can animate images using text descriptions,2024-02-14
apple,A four-pack of Apple AirTags is back on sale for $79,2024-02-04
apple,Ex-Apple engineer sentenced to six months in prison for stealing self-driving car tech,2024-02-09
apple,Here are the most useful Apple Vision Pro apps at launch,2024-02-02
apple,Indie labels say Apple Music’s spatial audio royalties only ‘benefit the biggest player’,2024-02-04
apple,US Secretary of Transportation states the obvious: Don't use the Apple Vision Pro while driving,2024-02-06
apple,"Google, Apple, Meta and other huge tech companies join US consortium to advance responsible AI",2024-02-08
apple,The latest Apple Pencil with USB-C charging falls to a new low price,2024-02-06
apple,The EU is reportedly set to hit Apple with a $539 million fine in antitrust probe,2024-02-18
apple,"MLB.TV's four-game Multiview feature is coming to Apple, Amazon and Google TV devices",2024-02-14
apple,It’s Apparently Easy to Crack the Apple Vision Pro's Front Screen,2024-02-24
apple,"Don't use smartwatches and rings that claim to measure blood sugar without needles, the FDA warns",2024-02-22
apple,Apple and Google Just Patched Their First Zero-Day Flaws of the Year,2024-01-31
apple,"Apple's 10th-gen iPad is $100 off, matching a record low",2024-02-16
apple,Why does Apple make it so hard to share the Vision Pro?,2024-02-16
apple,Zuck Tells Apple Vision Bros Their New Toy Sucks,2024-02-14
apple,Here’s What Reviewers Are Saying About the Apple Vision Pro,2024-01-30
apple,People Are Finding Very Unothodox Ways of Using Their Apple Vision Pro Headsets,2024-02-10
apple,The 256GB iPad mini is $120 off and down to a record-low price,2024-02-23
apple,You can now mark up your Google Docs with handwritten notes on Android devices,2024-02-26
apple,"The Morning After: Foldable iPhone rumors, Rogan’s new Spotify deal and more",2024-02-10
apple,Want to Stream Without Ads? That’ll Cost You,2024-01-29
apple,The AIs are officially out of control,2024-02-23
apple,"After trying the Vision Pro, Mark Zuckerberg says Quest 3 ‘is the better product, period’",2024-02-14
apple,Former Apple Engineer Gets Prison Time for Stealing Driverless Car Tech,2024-02-09
apple,Apple Vision Pro Teardown and Stress Test: Those Fake Eyes Can Take a Beating,2024-02-05
apple,Apple Vision Pro Hands-on: Brilliant AR Capabilities That Still Cost Too Darn Much,2024-02-13
apple,Video of Man 'Flying' Plane While Wearing the Apple Vision Pro Sparks Outrage,2024-02-07
apple,Movie Piracy App Surpassed Netflix and Disney+ on App Store Before Apple Killed It,2024-02-15
apple,iPhone 15 Pro Max Vs Samsung S24 Ultra Battery Life: Apple Finally Has Some Competition,2024-02-06
apple,"Apple MacBook Pro M3 Max vs. Razer Blade 16: Battle of the Heavyweight, Ultra-Expensive Laptops",2024-02-22
apple,Apple Investigating 'Ghost Touches' Issue Affecting Some Series 9 and Ultra 2 Watches,2024-02-10
apple,Save over $100 on the 10th-gen iPad with two years of AppleCare+,2024-02-02
apple,Apple Shares Vision Pro User Guide and Dozens of Support Documents With Useful Tips,2024-02-03
apple,Apple Card Users Earned More Than $1 Billion in Daily Cash Last Year,2024-01-30
apple,iOS 17.4 Beta Lets Apple Cash Users Generate Virtual Card Numbers,2024-02-12
apple,One of the last small-ish Android phones looks like it’s going the way of the iPhone Mini,2024-02-20
apple,Android 15’s first developer preview has arrived,2024-02-16
apple,Apple Now Selling $300 Developer Strap for Vision Pro,2024-02-02
apple,Apple Shares New 'First-Timer' Ad for Vision Pro,2024-02-02
apple,Apple Settles Trade Secret Lawsuit With SoC Startup Rivos,2024-02-09
apple,iFixit Shares Apple Vision Pro Teardown,2024-02-03
apple,Apple Won't Face AliveCor Antitrust Lawsuit Over Apple Watch Heart Rate Technology,2024-02-06
apple,Apple Vision Pro Launches: 'The Era of Spatial Computing Has Arrived',2024-02-02
apple,Apple Vision Pro Demos Can Be Reserved Online Starting Monday,2024-02-02
apple,HP Envy Move All-in-One Hands-on: Not the Apple iMac Replacement We Were Hoping For,2024-02-05
apple,"Best Buy Takes $90 Off Large Collection of Apple Watch Series 9 Models, Starting at $309",2024-02-13
apple,Apple Vision Pro's Developer Strap and Diagnostics Mode Revealed in More Detail,2024-02-02
apple,"OpenAI Sora's Breaks Our Brains, Vision Pro Loses Its Luster, and More Big Tech News",2024-02-17
apple,NVIDIA becomes the third most valuable US company at Alphabet's expense,2024-02-15
apple,Google finally brings Wallet passes to Wear OS watches along with transit directions,2024-02-26
apple,Apple Music Launches Monthly Replay Experience,2024-02-20
apple,Apple Vision Pro Reviews and Unboxing Videos Shared Ahead of Launch,2024-01-30
apple,The Morning After: Samsung gets FDA approval for its sleep apnea feature on Galaxy Watch,2024-02-12
apple,'Apple Sports' App Announced With Personalized Scoreboards and More,2024-02-21
apple,"Apple Music Super Bowl Ad Features Tim Cook, Ludacris and More",2024-02-07
apple,Apple Shares Overview of Vision Pro's Privacy and Security Features,2024-02-13
apple,Apple Watch Series 9 Drops to Record Low $299 Price at Best Buy,2024-02-03
apple,Apple Vision Pro Review Roundup,2024-01-30
apple,Apple thanked a man charged with defrauding them out of more than $2.5 million in gift cards and electronics,2024-02-08
apple,Vision Pro Demo Appointments Begin Today at All Apple Stores in U.S.,2024-02-05
apple,Nvidia CEO calls for “Sovereign AI” as his firm overtakes Amazon in market value,2024-02-13
apple,Unsealed court doc shows why Apple rejected Microsoft’s offer to buy Bing,2024-02-26
apple,Apple Music 'Replay 2024' Playlist Now Available,2024-01-30
apple,Apple Releases New Firmware for AirPods Max,2024-01-30
apple,Apple Vision Pro Apps to Check Out,2024-02-02
apple,Apple Music Not Working For Some Users,2024-01-29
apple,Apple Preparing iOS 17.3.1 Update for iPhone,2024-02-05
apple,Apple Now Has More Than 2.2 Billion Active Devices Worldwide,2024-02-01
apple,Apple Adds Last MacBook Pro With CD Drive to Obsolete Products List,2024-01-31
apple,Vision Pro Demo Appointments Begin Tomorrow at All U.S. Apple Stores,2024-02-01
apple,'Masters of the Air' Sees Most Watched Apple TV+ Launch to Date,2024-02-20
apple,Apple declares last MacBook Pro with an optical drive obsolete,2024-01-31
apple,Apple Developing AI Tool to Help Developers Write Code for Apps,2024-02-15
apple,The Vision Pro Review: I'm running out of reasons to wear Apple's futuristic headset after a week,2024-02-15
apple,Apple's Vision Pro is meant to be used when you're alone. You look weird if you wear it in public — at least for now.,2024-02-05
google,Google Splits Up Its Responsible AI Team,2024-01-31
google,The 4K Google Chromecast is back on sale for $40,2024-02-05
google,Google engineers modded a PlayStation Portal to emulate PSP games,2024-02-20
google,Google explains why Gemini's image generation feature overcorrected for diversity,2024-02-24
google,Google Prepares for a Future Where Search Isn’t King,2024-02-08
google,Google Tests Killing the News,2024-02-23
google,Google spent billions of dollars to lay people off,2024-01-30
google,"Microsoft, OpenAI, Google and others agree to combat election-related deepfakes",2024-02-16
google,Google Pay is shutting down in the US later this year,2024-02-23
google,You can now mark up your Google Docs with handwritten notes on Android devices,2024-02-26
google,Google brings Gemini to Messages and adds AI text summaries for Android Auto,2024-02-26
google,"Google, Apple, Meta and other huge tech companies join US consortium to advance responsible AI",2024-02-08
google,Google starts a limited test of generative AI tools in Maps,2024-02-01
google,"MLB.TV's four-game Multiview feature is coming to Apple, Amazon and Google TV devices",2024-02-14
google,Google finally brings Wallet passes to Wear OS watches along with transit directions,2024-02-26
google,Google pauses Gemini’s ability to generate people after overcorrecting for diversity in historical images,2024-02-22
google,Google Rebrands Its AI Chatbot as Gemini to Take On ChatGPT,2024-02-08
google,Gemini Advanced Is a Central Part of Google's Subscription Future,2024-02-08
google,"How to Get Gemini Advanced, Google's Subscription-Only AI Chatbot",2024-02-08
google,Apple and Google Just Patched Their First Zero-Day Flaws of the Year,2024-01-31
google,Google apologizes for ‘missing the mark’ after Gemini generated racially diverse Nazis,2024-02-21
google,Google's Duet AI for businesses is now called Gemini too,2024-02-21
google,Google brings a version of Pixel's 'Hold for Me' tool to more phones and desktop via Search,2024-02-16
google,Google’s use of student data could effectively ban Chromebooks from Denmark schools,2024-02-08
google,Wear OS is revamping notifications to improve battery life,2024-02-26
google,The Pixel 8 is getting Google’s new AI search feature today,2024-01-31
google,Google Is Sunsetting the Google Pay App,2024-02-23
google,Google’s ‘Woke’ Image Generator Shows the Limitations of AI,2024-02-22
google,Is Google Gemini the end of Google Assistant?,2024-02-09
google,Arc’s New AI Browser Features Are an Act of War Against Google Search,2024-02-02
google,"The Google Pixel Fold 2 Has Leaked, and Baby, It’s Got Back",2024-02-07
google,Google Pauses Gemini’s Image Generator After It Was Accused of Being Racist Against White People,2024-02-22
google,The AIs are officially out of control,2024-02-23
google,Here Comes the Flood of AI-Generated Clickbait,2024-02-15
google,Ring’s cheapest subscription plan is going up by $10 a year,2024-02-09
google,I Tested a Next-Gen AI Assistant. It Will Blow You Away,2024-02-01
google,Google app update reveals Google doesn't know what to call Assistant with Bard,2024-01-30
google,Google teases redesign for Sign in with Google with a 'new look' on the way,2024-02-12
google,The second-gen Apple HomePod is down to $285 in a rare sale,2024-02-23
google,"21 Best Presidents' Day Deals (2024): Tech, Couches, and More",2024-02-16
google,"21 Best Presidents' Day Deals (2024): Tech, Couches, and More",2024-02-16
google,Google adds useful Assistant feature to Gemini,2024-02-22
google,How to use 'Photomoji' in Google Messages,2024-02-05
google,Google Assistant stalls for Android Auto users,2024-02-10
google,Google Messages starts rolling out Screen Effects,2024-02-16
google,"Google's Gemini 1.5 Pro is a new, more efficient AI model",2024-02-15
google,Android 15’s first developer preview has arrived,2024-02-16
google,JBL Authentics 300 smart speaker review: two assistants at once,2024-02-08
google,"Music Piracy Is Back, Baby",2024-02-01
google,Who makes money when AI reads the internet for us?,2024-02-09
google,"Google Gemini AI explained: Cost, features, availability, and controversies",2024-02-14
google,New Google Chat update makes it easier to save messages,2024-02-07
google,Google drops the first Android 15 developer preview,2024-02-16
google,More evidence surfaces showing Google Messages' edit feature in action,2024-02-16
google,What Apple can learn from Google and Samsung about AI,2024-02-17
google,Google One hits a big milestone with its subscriber base,2024-02-12
google,Google vows to address Gemini's existing issues fast,2024-02-12
google,'Gemini Enterprise' launches amid Google One's new 'AI Premium' plan,2024-02-21
google,New update to Google Workspace makes finding comments way easier,2024-02-17
google,Google explains what went wrong with Gemini's AI image generation,2024-02-23
google,Google Meet brings Companion Mode to mobile devices,2024-02-13
google,Google plans to bring new cross-device features to Android,2024-02-13
google,Google may release the first Android 15 preview very soon,2024-02-14
google,Google makes passkeys virtually accessible to everyone with new alliance,2024-02-02
google,Google Assistant becomes Gemini – but only in certain countries,2024-02-22
google,The Google Pay app is shutting down later this year,2024-02-22
google,Google halts AI image generation on Gemini following backlash,2024-02-22
google,YouTube TV gets a 1080p Enhanced option that offers better video quality,2024-02-07
google,The Story Behind Elon Musk’s Tweet Restriction Fiasco,2024-02-14
google,Google issues Gemini AI privacy warning,2024-02-14
google,Google adds AI writing help to Chrome,2024-02-23
google,Google Joins Satellite Mission To Scan Globe for Methane Leaks,2024-02-14
google,OpenAI Develops Web Search Product in Challenge To Google,2024-02-15
google,Google Tests Removing the News Tab From Search Results,2024-02-23
google,Reddit in AI Content Licensing Deal With Google,2024-02-22
google,Google Pauses AI Image-generation of People After Diversity Backlash,2024-02-22
google,Google Shareholders to Receive $350 Million in Lawsuit Settlement,2024-02-12
google,Google spent $2.1 billion on layoffs last year,2024-01-30
google,Samsung Galaxy S24: First Features You Should Try,2024-01-31
google,Google just can't seem to catch a break,2024-02-23
google,Samsung Galaxy S24 Ultra: What I Love and What I Don't,2024-02-05
google,Google debuts more powerful “Ultra 1.0” AI model in rebranded “Gemini” chatbot,2024-02-08
google,"Google upstages itself with Gemini 1.5 AI launch, one week after Ultra 1.0",2024-02-15
google,"Google goes “open AI” with Gemma, a free, open-weights chatbot family",2024-02-21
google,"Meta will label AI-generated content from OpenAI and Google on Facebook, Instagram",2024-02-06
google,Google launches Gemma: new open source AI tool for developers,2024-02-21
google,Spyware on the rise despite U.S. and Google efforts,2024-02-07
google,YouTube and Google drive Alphabet to $15bn revenue,2024-01-31
google,Android 15: Google may update Bluetooth audio sharing,2024-01-31
google,Google introduces advanced AI capabilities to advertisers through Gemini integration,2024-02-22
google,Unsealed court doc shows why Apple rejected Microsoft’s offer to buy Bing,2024-02-26
google,Microsoft Edge steals your data from Google Chrome,2024-01-31
google,Google Bard to be rebranded as Gemini – reports,2024-02-05
google,Google Gemini AI now in more countries for Android users,2024-02-12
google,Google expands AI offerings with launch of Gemini Advanced,2024-02-08
google,"News Weekly: Google rebrands Bard, Gemini arrives in Canada, and more",2024-02-10
google,Google Tasks is the best Gmail feature you forget to use,2024-02-09
google,Google confirms it is phasing out cache links in search results,2024-02-05
google,Google Bard's rebranding to Gemini might just be around the corner,2024-02-05
google,Google offers discounted Pixel Watch replacements to out-of-warranty users,2024-02-13
amazon,"Amazon launches Rufus, an AI-powered shopping assistant",2024-02-01
amazon,The Nintendo Switch has received a rare discount at Amazon,2024-02-01
amazon,Amazon left Roomba with a huge mess to clean up,2024-01-31
amazon,Amazon Prime Video Ads Start Today,2024-01-29
amazon,Amazon Fire tablets are up to 35 percent off right now,2024-02-06
amazon,The latest Amazon Echo Show 8 returns to an all-time low of $90,2024-02-06
amazon,Amazon Prime Video won't offer Dolby Vision and Atmos on its ad-supported plan,2024-02-13
amazon,"MLB.TV's four-game Multiview feature is coming to Apple, Amazon and Google TV devices",2024-02-14
amazon,Want to Stream Without Ads? That’ll Cost You,2024-01-29
amazon,Amazon Prime Video drops Dolby Vision and Atmos unless you pay extra,2024-02-13
amazon,Amazon Is Getting Sued Over Its Prime Video Fee Hike,2024-02-13
amazon,"The 14 best Presidents' Day sales at Amazon, Best Buy, Target and others to shop this weekend",2024-02-16
amazon,"Samsung Odyssey monitors are up to $1,000 off right now",2024-02-01
amazon,Walmart might buy Vizio to win the fight over cheap TVs,2024-02-13
amazon,JBL Authentics 300 smart speaker review: two assistants at once,2024-02-08
amazon,Today is the last day to score preorder promos on the Galaxy S24 series,2024-01-30
amazon,NVIDIA becomes the third most valuable US company at Alphabet's expense,2024-02-15
amazon,Amazon’s Cloud Boss Likens Generative AI Hype to the Dotcom Bubble,2024-02-07
amazon,"21 Best Presidents' Day Deals (2024): Tech, Couches, and More",2024-02-16
amazon,"21 Best Presidents' Day Deals (2024): Tech, Couches, and More",2024-02-16
amazon,The official Xbox wireless controller is down to $44 ($16 off),2024-02-20
amazon,The second-gen Apple HomePod is down to $285 in a rare sale,2024-02-23
amazon,You can snag a pair of Sonos’ excellent Era 100 speakers for $90 off right now,2024-02-15
amazon,"Amazon hides cheaper items with faster delivery, lawsuit alleges",2024-02-12
amazon,Pansonic's powerful Lumix S5 II is $800 off with a prime lens,2024-02-23
amazon,Amazon Confirms Fire TV Is Dropping Android,2024-02-02
amazon,"7 Best Valentine's Day Sex Toy Deals: Suction Toys, Vibrators, and Dildos",2024-02-05
amazon,Amazon Echo Hub review: An underpowered great idea,2024-02-21
amazon,Jeff Bezos' Miami move could save him $600 million in taxes on stock sale,2024-02-13
amazon,"Amazon hides lower priced items, claims lawsuit",2024-02-13
amazon,"Check Your Pack-and-Play Mattress: 20,000 Infant Beds Recalled - CNET",2024-02-23
amazon,Amazon Joins Companies Arguing US Labor Board is Unconstitutional,2024-02-16
amazon,Live updates: Amazon to report 4th-quarter earnings,2024-02-01
amazon,Sony's Spider-Man Shows Spin Up Some Interesting Developments,2024-02-17
amazon,Nvidia CEO calls for “Sovereign AI” as his firm overtakes Amazon in market value,2024-02-13
amazon,Amazon can’t hoover up Roomba after EU nixes $1.4B iRobot acquisition,2024-01-29
amazon,Amazon cancela la compra de iRobot (Roomba),2024-01-29
amazon,"Amazon drops $1.4 billion deal with iRobot amid EU resistance, spurring layoffs",2024-01-29
amazon,Amazon's effort to ditch Android on Fire TV may be taking shape,2024-02-04
amazon,Amazon enjoyed a strong Q4 thanks to record-breaking holiday sales,2024-02-02
amazon,Save over $100 on the 10th-gen iPad with two years of AppleCare+,2024-02-02
amazon,"Apple's 10th-gen iPad is $100 off, matching a record low",2024-02-16
amazon,"PayPal is laying off 2,500 employees",2024-01-30
amazon,Mark Zuckerberg has had quite the week,2024-02-02
amazon,Roomba maker hit with layoffs as Amazon calls off $1.7 billion cash deal,2024-01-29
amazon,Amazon content spending nears $19 Billion for 2023,2024-02-02
amazon,Amazon Prime Video's Ads Tier Loses Dolby Vision HDR and Dolby Atmos,2024-02-13
amazon,The Google Pixel Fold has suddenly crashed to a record low price at Best Buy — but how long will it last?,2024-02-13
amazon,Seriously?! The 2023 Amazon Fire HD 10 tablet is 42% off right now,2024-02-15
amazon,Apple Pencil 2 Falls to New Record Low Price of $79 on Amazon,2024-02-17
amazon,"Amazon Takes $300 Off Multiple Apple Studio Display Models, Available From $1,299.99",2024-02-19
amazon,The Washington house where Jeff Bezos founded Amazon is on sale for $2.3 million — take a look inside,2024-01-28
amazon,Walmart and Amazon face legal trouble for using a points system to track and fire employees over absences: lawyers,2024-02-21
amazon,Shokz OpenRun Pro Premium Bone-Conduction Headphones Are Just $140 at Amazon - CNET,2024-02-05
amazon,Jeff Bezos is just $8 billion away from overtaking Elon Musk to become the world's wealthiest person once more,2024-02-05
amazon,"A TikToker bought a $26,000 foldable house on impulse — and has absolutely no regrets",2024-02-04
amazon,Jeff Bezos' move to Miami shows just how hard it is to tax the rich,2024-02-13
amazon,Nvidia is more valuable than Amazon for the first time since 2002,2024-02-13
amazon,Jeff Bezos sells nearly 12 million Amazon shares worth at least $2 billion,2024-02-11
amazon,Jeff Bezos' great big February stock sell-off is complete,2024-02-21
amazon,Amazon lleva Alexa a los hoteles en España,2024-02-08
amazon,TikTok’s native app arrives for the Vision Pro,2024-02-15
amazon,Amazon delivered a box of cookies by drone to someone 15 minutes and 29 seconds after they ordered,2024-01-30
amazon,Amazon es acusada de recomendar los productos más caros,2024-02-09
amazon,You Can Get Apple's AirTag 4 Pack for $78.99 Right Now on Amazon,2024-02-07
amazon,Get the Apple Pencil 2 for $79 and AirTag 4 Pack for $78 Today on Amazon,2024-02-25
amazon,"With Miami Move, Jeff Bezos Proves Zip Codes Do Matter",2024-02-10
amazon,The Morning After: Mark Zuckerberg thinks the Quest 3 is much better than the Vision Pro,2024-02-15
amazon,"Valentine's Day Deals: Get All-Time Low Prices on AirPods, iPad, iPhone, MacBook Air, and More",2024-02-05
amazon,"Best Apple Deals of the Week: Get the Apple Pencil 2 for the Best-Ever Price of $79, $300 Off Studio Display, and More",2024-02-23
amazon,"Amazon Prime Video Drops Dolby Vision, Atmos Unless You Pay Extra",2024-02-13
amazon,Amazon Prime Video Ads Start From Today - Up To 3.5 Mins Per Hour,2024-01-29
amazon,Amazon delivery worker out of a job after he's accused of trying to steal a customer's puppy,2024-02-06
amazon,An ex-Amazon and Comcast recruiter said the most shocking thing she saw on a résume was a picture of someone holding a gun,2024-02-07
amazon,Jeff Bezos just sold off $2 billion in Amazon shares in what could be a strategy to make him the richest man in the world — again,2024-02-11
amazon,A former Amazon recruiter says one of the biggest mistakes job seekers make is putting Miss America-style statements in résumés,2024-02-13
amazon,MacKenzie Scott sold Amazon stock worth more than $10 billion last year,2024-01-29
amazon,20 of the most iconic Super Bowl commercials of all time,2024-02-09
amazon,Nvidia's value surges about $500 billion in 6 weeks — that's almost as much as Tesla is worth,2024-02-06
amazon,"News Weekly: Alphabet earnings soar, Bard picks up new tricks, and more",2024-02-03
amazon,One of our favorite noise-canceling earbuds is cheaper than ever,2024-02-07
amazon,Anker battery packs and charging accessories are up to 44 percent off,2024-02-20
amazon,"The Master of the Universe Movie Is Back On, Again",2024-02-13
amazon,Tim Cook Teases Big AI Announcement for Apple Later This Year,2024-02-02
amazon,Apple iOS 17.4: iMessage Gets Post-Quantum Encryption in New Update,2024-02-21
amazon,Tech Still Isn’t Doing Enough to Care for the Environment,2024-02-19
amazon,"The Garmin epix Pro (Gen 2) scores a historic 25% discount at Amazon, finally justifying its own existence (sort of)",2024-02-26
amazon,"Awesome Amazon Deals This Weekend: Save Big on Apple's AirPods 2, Amazon's Omni TV, Eugy L60 and More - CNET",2024-02-04
amazon,Samsung's Galaxy Tab A9 Plus Is Down to $190 at Amazon and Best Buy Right Now - CNET,2024-02-22
amazon,Nvidia is ahead of Amazon in market value — but for how long?,2024-02-13
amazon,10 Twisty Sci-Fi Movies On Amazon Prime To Watch Over And Over,2024-01-30
amazon,"Woot Discounts MagSafe Duo Charger to All-Time Low Price of $79.99, MagSafe Charger on Sale for $29.99",2024-01-30
amazon,"ESPN, Fox, and Warner Bros. are putting together a juggernaut sports streaming app",2024-02-06
amazon,Shopify’s ‘Magic’ AI image editor can make any product pics look professional,2024-01-31
amazon,Billionaire Jeff Bezos still uses a homemade scrappy door desk from the early days of launching Amazon,2024-01-29
amazon,"ESPN, Fox, and Warner Bros. Discovery are launching a streaming service just for sports this fall",2024-02-06
amazon,The latest Apple Pencil with USB-C charging falls to a new low price,2024-02-06
amazon,Nvidia Becomes Third Most Valuable US Company,2024-02-15
amazon,"Forcing workers back to the office is 'dinosaur management' — and companies risk losing out, expert says",2024-02-11
amazon,Aldi is the latest grocery store to use a rival version of Amazon's Just Walk Out tech,2024-02-08
microsoft,Microsoft LASERs away LLM inaccuracies,2024-01-31
microsoft,Microsoft prepares to take Xbox everywhere,2024-02-12
microsoft,Microsoft redesigns Copilot for the web and mobile,2024-02-07
