Symbol,Title,Date
microsoft,FTC accuses Microsoft of misrepresenting its Activision Blizzard plans after layoffs,2024-02-07
microsoft,The Console Wars Are Over. Some Influencers Won’t Let Them Go,2024-02-06
microsoft,Apple and Google Just Patched Their First Zero-Day Flaws of the Year,2024-01-31
microsoft,Intel’s CEO Says AI Is the Key to the Company’s Comeback,2024-02-22
microsoft,Microsoft may bring Bethesda’s Starfield and Indiana Jones games to the PS5 after all,2024-02-05
microsoft,Diablo IV will be the first Activision Blizzard title on Xbox Game Pass,2024-02-15
microsoft,"Microsoft, OpenAI, Google and others agree to combat election-related deepfakes",2024-02-16
microsoft,Microsoft says Palworld is the biggest ever third-party Game Pass launch,2024-01-31
microsoft,Microsoft’s legal department allegedly silenced an engineer who raised concerns about DALL-E 3,2024-01-30
microsoft,Wunderlist’s creators are back with a nifty new to-do app,2024-02-13
microsoft,Watch Phil Spencer discuss the future of Xbox at 3PM ET,2024-02-15
microsoft,Microsoft is working on its own DLSS-like upscaler for Windows 11,2024-02-12
microsoft,"Move Over OpenAI, Microsoft Has a New Darling Startup",2024-02-26
microsoft,Russian and North Korean hackers used OpenAI tools to hone cyberattacks,2024-02-14
microsoft,"How to Not Get Scammed Out of $50,000",2024-02-17
microsoft,Feds Say Activision Layoffs Violate Promises Microsoft Made in Merger Deal,2024-02-08
microsoft,Xbox's Hi-Fi Rush is coming to PS5 on March 19,2024-02-21
microsoft,"Xbox, Nintendo or PlayStation: does it still matter?",2024-02-15
microsoft,NVIDIA becomes the third most valuable US company at Alphabet's expense,2024-02-15
microsoft,Nvidia CEO calls for “Sovereign AI” as his firm overtakes Amazon in market value,2024-02-13
microsoft,Unsealed court doc shows why Apple rejected Microsoft’s offer to buy Bing,2024-02-26
microsoft,Do Xbox owners have a right to expect console exclusives?,2024-02-08
microsoft,AI Tools Like GitHub Copilot Are Rewiring Coders’ Brains. Yours May Be Next,2024-02-08
microsoft,"AI Not Hyped Enough, Says Microsoft Exec",2024-02-20
microsoft,Microsoft Flight Simulator World Update 16 takes you to the Caribbean,2024-01-31
microsoft,Amazon’s Cloud Boss Likens Generative AI Hype to the Dotcom Bubble,2024-02-07
microsoft,Microsoft Fixes Edge Browser Bug That Was Stealing Chrome Tabs and Data,2024-02-20
microsoft,"Defense Department alerts over 20,000 employees about email data breach",2024-02-14
microsoft,Microsoft Copilot’s new update lets you tweak AI-generated images right in chat,2024-02-09
microsoft,Microsoft announce new partnership with journalism organizations,2024-02-07
microsoft,"Apple, Microsoft granted exemptions from incoming EU digital legislation",2024-02-13
microsoft,Microsoft closes the loophole that allowed the Taylor Swift incident,2024-01-30
microsoft,Microsoft confirms full Xbox catalog playable in cloud later this year,2024-02-19
microsoft,Could Microsoft Flight Simulator be heading to PlayStation 5?,2024-02-16
microsoft,Microsoft Flight Simulator’s Dune Part Two’s collaboration brings free Ornithopter to the skies,2024-02-14
microsoft,"Microsoft, eBay, PayPal among tech giants 34,000 job cuts due to AI",2024-02-12
microsoft,AI has its Super Bowl moment with Microsoft Copilot,2024-02-08
microsoft,Microsoft earnings call: What can we expect from MSFT’s Q2 report,2024-01-30
microsoft,Microsoft Edge steals your data from Google Chrome,2024-01-31
microsoft,Microsoft launches new Vapor series of Xbox controllers,2024-01-31
microsoft,Microsoft Revives Aggressive Windows 11 Upgrade Campaign With Intrusive Popups,2024-02-06
microsoft,Microsoft 'Retires' Azure IoT Central In Platform Rethink,2024-02-16
microsoft,How a Microsoft Update Broke VS Code Editor on Ubuntu,2024-02-04
microsoft,Microsoft Closes Loophole That Created Taylor Swift Deepfakes,2024-01-29
microsoft,Microsoft Will Use Intel To Manufacture Home-Grown Processor,2024-02-21
microsoft,Microsoft Strikes Deal With Mistral in Push Beyond OpenAI,2024-02-26
microsoft,Meta’s free Code Llama AI programming tool closes the gap with GPT-4,2024-01-29
microsoft,Microsoft se une al club de Apple: diseñará sus propios chips y recurrirá a un viejo conocido para fabricarlos,2024-02-22
microsoft,"PayPal is laying off 2,500 employees",2024-01-30
microsoft,Google pauses Gemini’s ability to generate people after overcorrecting for diversity in historical images,2024-02-22
microsoft,Microsoft says it’s taking four unnamed Xbox games “to the other consoles”,2024-02-15
microsoft,"Google Says Microsoft Offered To Sell Bing To Apple in 2018, But Search-quality Issues Got in the Way",2024-02-26
microsoft,Microsoft warns of Iran’s advanced cyber operations targeting US elections,2024-02-07
microsoft,Figure AI in talks with Microsoft and OpenAI for funding,2024-01-31
microsoft,Microsoft gets set to reveal Xbox’s future plans,2024-02-13
microsoft,FTC seeks pause on Microsoft-Activision deal amid layoff controversy,2024-02-08
microsoft,Microsoft's Xbox boss says jacking up video game prices can end up being 'manipulative',2024-02-21
microsoft,"Microsoft's full set of Office apps will be available on Apple's Vision Pro — including the company's new AI assistant, Copilot",2024-02-01
microsoft,"Satya Nadella's life and career, from computer-science student to CEO of Microsoft and turning it into a $3 trillion titan",2024-01-28
microsoft,"Microsoft lleva Teams, Word, Excel y Copilot al Apple Vision Pro",2024-01-31
microsoft,"Meet the Pranksters Behind Goody-2, the World’s ‘Most Responsible’ AI Chatbot",2024-02-09
microsoft,‘Every Screen is an Xbox’ Microsoft tries to pump up staff before today’s inevitable backlash,2024-02-15
microsoft,Microsoft's upcoming custom chip will be made by Intel,2024-02-22
microsoft,Here are the most useful Apple Vision Pro apps at launch,2024-02-02
microsoft,Sony misses PS5 sales target as console enters ‘latter stage of its life cycle’,2024-02-14
microsoft,Snag This HP Laptop Bundle Filled With Freebies for Just $400 at QVC - CNET,2024-02-19
microsoft,Microsoft's Super Bowl ad is a sign of the company's shifting AI priorities,2024-02-07
microsoft,"Since Steve Ballmer Retired 10 Years Ago, Microsoft's Valuation Has Increased 10X",2024-02-05
microsoft,"Microsoft Copilot AI climbs Google, Apple app store charts after Super Bowl ad (despite errors)",2024-02-12
microsoft,Microsoft CEO Satya Nadella worries hackers could cause a 'breakdown of world order',2024-01-31
microsoft,Indie game champion Day of the Devs is now an independent non-profit,2024-01-30
microsoft,Microsoft AI Engineer Says Company Thwarted Attempt To Expose DALL-E 3 Safety Problems,2024-01-31
microsoft,"Mistral releases new ‘top-tier’ AI model, partners with Microsoft",2024-02-26
microsoft,Microsoft to pump €3.2B into German AI technologies,2024-02-15
microsoft,Microsoft Not Planning on Xbox Cloud Gaming App for iOS Because There's 'Not Room' for Monetization,2024-02-15
microsoft,The first users of Microsoft’s AI bot ask if it’s worth the money,2024-02-14
microsoft,"Microsoft Teases Next-Gen Xbox With 'Largest Technical Leap', New 'Unique' Hardware",2024-02-15
microsoft,"Microsoft Relents, Will Support VS Code On Ubuntu 18.04 For One More Year",2024-02-10
microsoft,Microsoft President: 'You Can't Believe Every Video You See or Audio You Hear',2024-02-17
microsoft,"Microsoft, Google, Meta, X and Others Pledge To Prevent AI Election Interference",2024-02-16
microsoft,Tim Cook Teases Big AI Announcement for Apple Later This Year,2024-02-02
microsoft,Windows 11 Users Herded Toward 23H2 Via Automatic Upgrade,2024-02-22
microsoft,The Morning After: Want some hybrid meat rice?,2024-02-16
microsoft,Microsoft ignoró avisos sobre un exploit de DALL-E 3 que pudo influir en los deepfakes sexuales de Taylor Swift,2024-01-31
microsoft,China’s Hackers Keep Targeting US Water and Electricity Supplies,2024-02-03
microsoft,"Tim Cook, Steve Ballmer and Jamie Dimon are among the few US billionaires who didn't found a company or inherit a fortune",2024-02-08
microsoft,"In cloud, there's AI (which is hot) and everything else (which is not)",2024-02-01
microsoft,Microsoft designa a la directora general de ‘Call of Duty’ como nueva presidente de Blizzard,2024-01-29
microsoft,"Apple y Microsoft se salen con la suya: iMessage, Bing y Edge evitarán la Ley de Mercados Digitales",2024-02-13
microsoft,Microsoft invertirá una millonada en España para potenciar la inteligencia artificial,2024-02-19
microsoft,Telefónica integrará la IA de Microsoft Azure en su Kernel 2.0,2024-02-26
microsoft,Microsoft te perseguirá hasta el cansancio para que actualices tu PC a Windows 11,2024-02-09
microsoft,"Xbox chief announces mysterious event after weeks of leaks, layoffs, and drama",2024-02-06
microsoft,LinkedIn's New AI Chatbot Wants to Help You Find Your Next Job,2024-02-07
microsoft,Gab’s Racist AI Chatbots Have Been Instructed to Deny the Holocaust,2024-02-21
microsoft,Microsoft BitLocker encryption hacked by a cheap off-the-shelf Raspberry Pi Pico,2024-02-07
microsoft,Is Xbox ‘exclusive’ Starfield heading to PlayStation 5?,2024-02-05
tesla,Tesla has won the EV charging wars,2024-02-12
tesla,Tesla sued by 25 California counties for allegedly mishandling hazardous waste,2024-02-01
tesla,Tesla settles California hazardous waste lawsuit for $1.5 million,2024-02-02
tesla,Tesla Wins EV Charging: All Car Companies Using NACS,2024-02-13
tesla,Ford Is Giving Away Free Tesla Charger Converters That Will Unlock a New World of EV Power,2024-01-31
tesla,Tesla recalls over 2 million EVs because the warning light text is too small,2024-02-02
tesla,Tesla Recalling Almost Every Car It's Sold In The US,2024-02-02
tesla,The Morning After: That AI-generated George Carlin comedy special was written by humans,2024-01-29
tesla,Relatable: Elon Musk Is Mad About His Paycheck,2024-01-31
tesla,Tesla Lawyer Cried at a Deposition Because He Loves Elon So Much,2024-02-01
tesla,Elon Musk's Battle with Swedish Unions Is Now Impacting Tesla's Charging Stations,2024-02-23
tesla,This Is Why Tesla's Stainless Steel Cybertrucks May Be Rusting,2024-02-16
tesla,Elon Musk's Latest Robot Video Looks Like It Was Shot on a Phone From 2002,2024-02-24
tesla,Tesla is upgrading its Model Y's self-driving features in China amid fierce competition from BYD,2024-02-02
tesla,Stellantis will finally adopt Tesla-style fast charger plug,2024-02-13
tesla,Elon Musk is synonymous with Tesla. Is that good or bad for shareholders?,2024-02-09
tesla,Founding OpenAI Member Andrej Karpathy Leaves Company,2024-02-14
tesla,Tesla didn't run a Super Bowl ad. But a tech CEO calling for a boycott of the carmaker did.,2024-02-12
tesla,Elon Musk’s $56bn Tesla pay package voided by Delaware judge,2024-01-31
tesla,Tesla settles hazardous waste lawsuit in California,2024-02-02
tesla,Ford CEO confirms complimentary charging adapters coming soon,2024-01-31
tesla,Tesla is facing a lawsuit alleging it mishandled hazardous waste,2024-02-01
tesla,Tesla owners are peeved about an update that was meant to fix Autopilot,2024-01-29
tesla,Elon Musk wants to sell more Teslas in Japan. Here's why that could be tricky.,2024-01-28
tesla,"Tesla knocks $1,000 off the price of its Model Y cars in the US to boost sales",2024-02-12
tesla,"The Tesla chair was meant to rein in Elon Musk, but she's shunned the spotlight. A court ruling has dragged her into it.",2024-02-21
tesla,"Lucid Slashes Air Prices, Long Range EV Now as Much as $8,000 Cheaper - CNET",2024-02-15
tesla,What it's like to take the Cybertruck camping,2024-02-10
tesla,"Tesla's board faces a 'tornado situation' after Elon Musk's $55 billion pay package was struck down, analysts say",2024-02-02
tesla,Kim Kardashian seems to be the latest celebrity to join the ranks of Cybertruck owners,2024-02-20
tesla,Wife of Tesla employee who died in what may have been the first 'full self-driving' crash said she and her husband were 'guinea pigs',2024-02-14
tesla,"Tesla workers still make less than those at Ford and GM, despite recent raises",2024-02-09
tesla,Tesla made $1.8 billion last year from a side hustle,2024-02-12
tesla,Donald Trump Pledges to Protect AM Radio in Rambling Speech to Christian Broadcasters,2024-02-23
tesla,Tesla ditched language saying it was 'a majority-minority workforce' after Elon Musk said 'DEI must die',2024-01-30
tesla,Some Cybertruck owners say their Teslas are starting to rust in the rain,2024-02-14
tesla,Tesla's new update is designed to make charging in the cold less of a headache,2024-02-15
tesla,Elon Musk says Tesla's Optimus lab looks like something out of 'Westworld',2024-01-29
tesla,Why Elon Musk's battle with Delaware is about more than a $55 billion pay package,2024-01-31
tesla,Elon Musk is now worth just under $200 billion — and Jeff Bezos is only $15 billion behind,2024-01-29
tesla,"Elon Musk says the people have spoken, and he'll make moves to shift Tesla to be incorporated in Texas",2024-02-01
tesla,"Elon Musk may be done with Delaware, but don't expect other corporations to follow his crusade",2024-02-21
tesla,"Former Tesla director Larry Ellison invited Elon Musk to Hawaii to 'dry out' from drugs, report says",2024-02-04
tesla,Elon Musk's lawyer is helping Adam Neumann as he tries to buy back WeWork,2024-02-07
tesla,Ford is not giving up on EVs — and has Elon Musk's 'affordable Tesla' in its sights,2024-02-07
tesla,Leaked Tesla pay data: How much Elon Musk's factory workers now make across the US after some got raises,2024-02-08
tesla,"You can now get Tesla's Cybertruck in 3 more colors, including 'satin abyss blue,' if you're willing to pay up to $6,500 more",2024-02-22
tesla,SpaceX files to relocate to Texas after Elon Musk's spat with Delaware over pay package,2024-02-15
tesla,Jeff Bezos is just $8 billion away from overtaking Elon Musk to become the world's wealthiest person once more,2024-02-05
tesla,"Elon Musk cannot keep Tesla pay package worth more than $55 billion, judge rules",2024-01-31
tesla,BYD may build electric vehicle factory in Mexico for US market,2024-02-14
tesla,Neuralink exec Shivon Zilis defends Elon Musk's $55 billion Tesla pay package,2024-01-31
tesla,Elon Musk compares the AI race to playing poker — you need to spend billions every year just to sit at the table,2024-01-29
tesla,A group of people chilling on a sauna boat sailed to a Tesla's rescue after the vehicle plunged into an icy fjord,2024-02-02
tesla,Tesla issues recall for most of its cars in the US over warning light issue,2024-02-02
tesla,Moron’s are wearing Apple Vision Pro while driving Tesla on autopilot,2024-02-06
tesla,Elon Musk says he’ll move Tesla’s legal HQ to Texas,2024-02-01
tesla,Cybertruck engineer addresses claims the Tesla EVs rust in the rain,2024-02-19
tesla,"The 2024 EV Tax Credit: Big Rebate, Small List - CNET",2024-02-05
tesla,Check out Tesla rival BYD's $233K electric supercar that has Ferrari and McLaren vibes,2024-02-26
tesla,"Tesla llega a Colombia, confirmado: los detalles de la llegada de los coches eléctricos de Elon Musk al país",2024-02-24
tesla,Tesla Model Y Juniper: Todo lo que sabemos del rediseño del coche más popular del mundo,2024-02-12
tesla,BYD Seal U llega a España: el coche chino que le planta cara al Tesla Model Y,2024-01-29
tesla,BYD sigue los pasos de Tesla y construirá su próxima fábrica de coches eléctricos en México,2024-02-14
tesla,Pete Buttigieg warns people not to wear the Apple Vision Pro while driving after a viral video showed someone wearing one behind the wheel of a Cybertruck,2024-02-06
tesla,Lucid slashes prices for its luxury EVs for the third time in seven months,2024-02-15
tesla,Polestar's CEO just hinted at a looming problem in the EV market: Tanking used values,2024-02-06
tesla,Judge voids Musk's $56 billion Tesla pay package,2024-01-30
tesla,Elon Musk's Tesla $55B pay package voided by judge,2024-01-30
tesla,The AI Industry Has a Not So Secret Weapon: Lobbyists,2024-02-02
tesla,"EVs won over early adopters, but mainstream buyers aren't along for the ride yet",2024-02-07
tesla,Elon Musk might be right. Chinese EV firms could 'demolish' their US rivals.,2024-02-02
tesla,"Elon Musk's company directors feel an 'expectation' to use drugs with him to avoid upsetting the billionaire, report says",2024-02-04
tesla,On a Tesla: Don't,2024-01-29
tesla,Nvidia's value surges about $500 billion in 6 weeks — that's almost as much as Tesla is worth,2024-02-06
tesla,Tesla Grünheide: Ministerium befürchtet Abfuhr für Bebauungsplan durch Bürger,2024-02-07
tesla,Elon Musk ordered to testify in Twitter takeover investigation,2024-02-12
tesla,Tesla no tendrá que pagar los 55.000 millones de compensación para Musk: la lucha por el poder en Tesla se recrudece,2024-01-31
tesla,"Nuevo Tesla Model 2: fecha de lanzamiento, precio, modelos y todo lo que creemos saber sobre el coche eléctrico de los 25.000 euros",2024-02-01
tesla,"Elon Musk afirma que Tesla tiene ""el mejor modelo del mundo"" para crear vídeo. Es difícil de creer",2024-02-19
tesla,Video of Man 'Flying' Plane While Wearing the Apple Vision Pro Sparks Outrage,2024-02-07
tesla,Tesla temporarily slashes prices for some Model Y cars in the US,2024-02-10
tesla,Un inglés llamó Tesla a su restaurante. Se ha quedado sin su marca y con una multa de 14.000 euros,2024-02-12
tesla,The 10 most deeply discounted electric cars right now,2024-02-25
tesla,Twitter employees monitored Elon Musk's jet-tracking account to see when he'd be in the office,2024-02-20
tesla,"Microsoft and OpenAI are in talks to inject $500 million into humanoid robotics startup Figure AI, report says",2024-01-31
tesla,A Senate hearing with top tech CEOs about online child safety had plenty of fireworks,2024-02-01
tesla,Tesla recalling nearly 2.2M vehicles for software update to fix warning lights,2024-02-02
tesla,"Without $55B Tesla Pay Court Ruled ‘Excessive,’ Elon Musk Would Not Be World’s Richest Man",2024-01-31
tesla,Elon Musk quiere llevar la IA de Tesla al siguiente nivel. Para lograrlo necesita dos aliados: NVIDIA y AMD,2024-01-30
tesla,"Tesla cuts prices by $1,000 for some Model Y cars in the U.S.",2024-02-12
tesla,Tesla owners are upset about an update that was meant to fix Autopilot,2024-01-30
tesla,"Tesla asks which jobs are critical, stoking layoff fears",2024-02-07
tesla,Shifting Tesla incorporation to Texas may not give Musk what he wants,2024-02-03
tesla,"Tesla Cybertruck wheel covers, it turns out, are rubbing into the tire sidewalls",2024-02-02
tesla,Elon Musk can't keep $56 billion Tesla pay package as judge sides with shareholders,2024-01-30
tesla,Tesla recalling nearly 2.2M vehicles for software update to fix warning lights,2024-02-02
tesla,Tesla Model 3 Highland First Look: Exterior and Interior Review,2024-02-16
tesla,Ford's free Tesla NACS adapter surfaces online,2024-02-25
tesla,Hubo un día en el que Toyota y Tesla desarrollaron un coche eléctrico juntos. Y fue un espejo de su situación actual,2024-02-10
